{
  "facility_id": "gn-siguiri-fac",
  "name": "Siguiri",
  "aliases": [
    "Siguiri",
    "Siguiri",
    "Siguiri"
  ],
  "country_iso3": "GN",
  "location": {
    "lat": 11.564,
    "lon": -9.357,
    "precision": "site"
  },
  "types": [
    "mine"
  ],
  "commodities": [
    {
      "metal": "gold",
      "primary": true
    }
  ],
  "status": "unknown",
  "owner_links": [],
  "operator_link": null,
  "products": [],
  "sources": [
    {
      "type": "mines_csv",
      "row": 3382
    }
  ],
  "verification": {
    "status": "csv_imported",
    "confidence": 0.85,
    "last_checked": "2025-10-12T19:43:44.051943",
    "checked_by": "migration_script"
  }
}