{
  "facility_id": "mex-el-chanate-fac",
  "name": "El Chanate",
  "aliases": [
    "El Chanate",
    "El Chanate"
  ],
  "country_iso3": "MEX",
  "location": {
    "lat": 30.792,
    "lon": -111.926,
    "precision": "site"
  },
  "types": [
    "mine"
  ],
  "commodities": [
    {
      "metal": "gold",
      "primary": true
    },
    {
      "metal": "silver",
      "primary": false
    }
  ],
  "status": "unknown",
  "owner_links": [],
  "operator_link": null,
  "products": [],
  "sources": [
    {
      "type": "mines_csv",
      "row": 7943
    }
  ],
  "verification": {
    "status": "csv_imported",
    "confidence": 0.85,
    "last_checked": "2025-10-12T19:43:44.393684",
    "checked_by": "migration_script"
  }
}