{
  "facility_id": "chn-xiangning-shenjiao-coal-mine-fac",
  "name": "Xiangning Shenjiao Coal Mine",
  "aliases": [],
  "country_iso3": "CHN",
  "location": {
    "lat": 36.128,
    "lon": 111.078,
    "precision": "site"
  },
  "types": [
    "mine"
  ],
  "commodities": [
    {
      "metal": "metallurgical coal",
      "primary": true
    }
  ],
  "status": "unknown",
  "products": [],
  "sources": [
    {
      "type": "mines_csv",
      "row": 5432
    }
  ],
  "verification": {
    "status": "csv_imported",
    "confidence": 0.65,
    "last_checked": "2025-10-12T19:43:44.216335",
    "checked_by": "migration_script"
  }
}