{
  "facility_id": "chn-henan-zhenghong-hengtai-xinmi-coal-mine-fac",
  "name": "Henan Zhenghong Hengtai Xinmi Coal Mine",
  "aliases": [],
  "country_iso3": "CHN",
  "location": {
    "lat": 34.518,
    "lon": 113.516,
    "precision": "site"
  },
  "types": [
    "mine"
  ],
  "commodities": [
    {
      "metal": "thermal coal",
      "primary": true
    }
  ],
  "status": "unknown",
  "owner_links": [],
  "operator_link": null,
  "products": [],
  "sources": [
    {
      "type": "mines_csv",
      "row": 6468
    }
  ],
  "verification": {
    "status": "csv_imported",
    "confidence": 0.65,
    "last_checked": "2025-10-12T19:43:44.244667",
    "checked_by": "migration_script"
  }
}