{
  "facility_id": "ir-zemestan-yurt-coal-mine-fac",
  "name": "Zemestan Yurt Coal Mine",
  "aliases": [],
  "country_iso3": "IR",
  "location": {
    "lat": 37.028,
    "lon": 55.294,
    "precision": "site"
  },
  "types": [
    "mine"
  ],
  "commodities": [
    {
      "metal": "metallurgical coal",
      "primary": true
    }
  ],
  "status": "unknown",
  "owner_links": [],
  "operator_link": null,
  "products": [],
  "sources": [
    {
      "type": "mines_csv",
      "row": 4419
    }
  ],
  "verification": {
    "status": "csv_imported",
    "confidence": 0.65,
    "last_checked": "2025-10-12T19:43:44.151966",
    "checked_by": "migration_script"
  }
}