{
  "facility_id": "esp-aznalcollar-mine-fac",
  "name": "Aznalcollar Mine",
  "aliases": [
    "Aznalcollar Mine",
    "Los Frailes",
    "Los Frailes",
    "Aznalcollar Smelter",
    "Aznalcollar Refinery"
  ],
  "country_iso3": "ESP",
  "location": {
    "lat": 37.516,
    "lon": -6.254,
    "precision": "site"
  },
  "types": [
    "mine",
    "smelter",
    "refinery"
  ],
  "commodities": [
    {
      "metal": "copper",
      "primary": true
    },
    {
      "metal": "gold",
      "primary": false
    },
    {
      "metal": "lead",
      "primary": false
    },
    {
      "metal": "silver",
      "primary": false
    },
    {
      "metal": "zinc",
      "primary": false
    }
  ],
  "status": "unknown",
  "owner_links": [],
  "operator_link": null,
  "products": [],
  "sources": [
    {
      "type": "mines_csv",
      "row": 1485
    }
  ],
  "verification": {
    "status": "csv_imported",
    "confidence": 0.65,
    "last_checked": "2025-10-12T19:43:43.181512",
    "checked_by": "migration_script"
  }
}