{
  "facility_id": "ind-lmel-surjagarh-mine-fac",
  "name": "LMEL Surjagarh Mine",
  "aliases": [],
  "country_iso3": "IND",
  "location": {
    "lat": 19.625,
    "lon": 80.366,
    "precision": "site"
  },
  "types": [
    "mine"
  ],
  "commodities": [
    {
      "metal": "iron ore",
      "primary": true
    }
  ],
  "status": "unknown",
  "owner_links": [],
  "operator_link": null,
  "products": [],
  "sources": [
    {
      "type": "mines_csv",
      "row": 7682
    }
  ],
  "verification": {
    "status": "csv_imported",
    "confidence": 0.65,
    "last_checked": "2025-10-12T19:43:44.333735",
    "checked_by": "migration_script"
  }
}