{
  "facility_id": "ua-ferrexpo-poltava-mining-fac",
  "name": "Ferrexpo Poltava Mining",
  "aliases": [
    "Ferrexpo Poltava Mining",
    "Ferrexpo Poltava Mine",
    "Poltava",
    "Poltavsky"
  ],
  "country_iso3": "UA",
  "location": {
    "lat": 49.037,
    "lon": 33.668,
    "precision": "site"
  },
  "types": [
    "mine"
  ],
  "commodities": [
    {
      "metal": "iron ore",
      "primary": true
    }
  ],
  "status": "unknown",
  "owner_links": [],
  "operator_link": null,
  "products": [],
  "sources": [
    {
      "type": "mines_csv",
      "row": 2831
    }
  ],
  "verification": {
    "status": "csv_imported",
    "confidence": 0.85,
    "last_checked": "2025-10-12T19:43:43.967850",
    "checked_by": "migration_script"
  }
}