{
  "facility_id": "zaf-atok-fac",
  "name": "Atok",
  "aliases": [],
  "country_iso3": "ZAF",
  "location": {
    "lat": -24.263,
    "lon": 29.86,
    "precision": "site"
  },
  "types": [
    "mine"
  ],
  "commodities": [
    {
      "metal": "copper",
      "primary": true
    }
  ],
  "status": "unknown",
  "products": [],
  "sources": [
    {
      "type": "mines_csv",
      "row": 2422
    }
  ],
  "verification": {
    "status": "csv_imported",
    "confidence": 0.2,
    "last_checked": "2025-10-12T19:43:43.842553",
    "checked_by": "migration_script"
  }
}