{
  "facility_id": "idn-dbs-coal-mine-fac",
  "name": "DBS Coal Mine",
  "aliases": [],
  "country_iso3": "IDN",
  "location": {
    "lat": -1.45,
    "lon": 102.688,
    "precision": "site"
  },
  "types": [
    "mine"
  ],
  "commodities": [
    {
      "metal": "thermal coal",
      "primary": true
    }
  ],
  "status": "unknown",
  "owner_links": [],
  "operator_link": null,
  "products": [],
  "sources": [
    {
      "type": "mines_csv",
      "row": 5849
    }
  ],
  "verification": {
    "status": "csv_imported",
    "confidence": 0.65,
    "last_checked": "2025-10-12T19:43:44.240550",
    "checked_by": "migration_script"
  }
}