{
  "facility_id": "per-relampago-no-6-mina-fac",
  "name": "Relampago No. 6, Mina",
  "aliases": [],
  "country_iso3": "PER",
  "location": {
    "lat": -13.598,
    "lon": -75.414,
    "precision": "site"
  },
  "types": [
    "mine"
  ],
  "commodities": [
    {
      "metal": "silver",
      "primary": true
    }
  ],
  "status": "unknown",
  "owner_links": [],
  "operator_link": null,
  "products": [],
  "sources": [
    {
      "type": "mines_csv",
      "row": 233
    }
  ],
  "verification": {
    "status": "csv_imported",
    "confidence": 0.2,
    "last_checked": "2025-10-12T19:43:42.537648",
    "checked_by": "migration_script"
  }
}