{
  "facility_id": "usa-day-branch-mine-fac",
  "name": "Day Branch Mine",
  "aliases": [],
  "country_iso3": "USA",
  "location": {
    "lat": 36.751,
    "lon": -83.228,
    "precision": "site"
  },
  "types": [
    "mine"
  ],
  "commodities": [
    {
      "metal": "coal",
      "primary": true
    }
  ],
  "status": "unknown",
  "products": [],
  "sources": [
    {
      "type": "mines_csv",
      "row": 6690
    }
  ],
  "verification": {
    "status": "csv_imported",
    "confidence": 0.65,
    "last_checked": "2025-10-12T19:43:44.246071",
    "checked_by": "migration_script"
  }
}