{
  "facility_id": "chn-changxu-surface-mine-fac",
  "name": "Changxu Surface Mine",
  "aliases": [
    "Changxu Surface Mine",
    "Laiyegou"
  ],
  "country_iso3": "CHN",
  "location": {
    "lat": 39.459,
    "lon": 110.49,
    "precision": "site"
  },
  "types": [
    "mine"
  ],
  "commodities": [
    {
      "metal": "thermal coal",
      "primary": true
    }
  ],
  "status": "unknown",
  "products": [],
  "sources": [
    {
      "type": "mines_csv",
      "row": 4165
    }
  ],
  "verification": {
    "status": "csv_imported",
    "confidence": 0.85,
    "last_checked": "2025-10-12T19:43:44.129878",
    "checked_by": "migration_script"
  }
}