{
  "facility_id": "mwi-kasikizi-coal-mine-fac",
  "name": "Kasikizi Coal Mine",
  "aliases": [],
  "country_iso3": "MWI",
  "location": {
    "lat": -10.015,
    "lon": 33.812,
    "precision": "site"
  },
  "types": [
    "mine"
  ],
  "commodities": [
    {
      "metal": "thermal coal",
      "primary": true
    }
  ],
  "status": "unknown",
  "products": [],
  "sources": [
    {
      "type": "mines_csv",
      "row": 4476
    }
  ],
  "verification": {
    "status": "csv_imported",
    "confidence": 0.65,
    "last_checked": "2025-10-12T19:43:44.171451",
    "checked_by": "migration_script"
  }
}