{
  "facility_id": "chn-ningixa-jinneng-coal-mine-fac",
  "name": "Ningixa Jinneng Coal Mine",
  "aliases": [],
  "country_iso3": "CHN",
  "location": {
    "lat": 39.246,
    "lon": 106.776,
    "precision": "site"
  },
  "types": [
    "mine"
  ],
  "commodities": [
    {
      "metal": "coal",
      "primary": true
    }
  ],
  "status": "unknown",
  "owner_links": [],
  "operator_link": null,
  "products": [],
  "sources": [
    {
      "type": "mines_csv",
      "row": 6435
    }
  ],
  "verification": {
    "status": "csv_imported",
    "confidence": 0.65,
    "last_checked": "2025-10-12T19:43:44.244432",
    "checked_by": "migration_script"
  }
}