{
  "facility_id": "alb-batra-martanesh-fac",
  "name": "Batra/Martanesh",
  "aliases": [
    "Batra/Martanesh",
    "Thekna"
  ],
  "country_iso3": "ALB",
  "location": {
    "lat": 41.418,
    "lon": 20.293,
    "precision": "site"
  },
  "types": [
    "mine"
  ],
  "commodities": [
    {
      "metal": "chromium",
      "primary": true
    }
  ],
  "status": "unknown",
  "products": [],
  "sources": [
    {
      "type": "mines_csv",
      "row": 1414
    }
  ],
  "verification": {
    "status": "csv_imported",
    "confidence": 0.65,
    "last_checked": "2025-10-12T19:43:43.142597",
    "checked_by": "migration_script"
  }
}