{
  "facility_id": "usa-birch-river-mine-fac",
  "name": "Birch River Mine",
  "aliases": [
    "Birch River Mine",
    "Birch River",
    "Eastern"
  ],
  "country_iso3": "USA",
  "location": {
    "lat": 38.432,
    "lon": -80.6,
    "precision": "site"
  },
  "types": [
    "mine"
  ],
  "commodities": [
    {
      "metal": "coal",
      "primary": true
    }
  ],
  "status": "unknown",
  "owner_links": [],
  "operator_link": null,
  "products": [],
  "sources": [
    {
      "type": "mines_csv",
      "row": 6898
    }
  ],
  "verification": {
    "status": "csv_imported",
    "confidence": 0.85,
    "last_checked": "2025-10-12T19:43:44.247311",
    "checked_by": "migration_script"
  }
}