{
  "facility_id": "chn-anshun-sandu-coal-mine-fac",
  "name": "Anshun Sandu Coal Mine",
  "aliases": [],
  "country_iso3": "CHN",
  "location": {
    "lat": 37.484,
    "lon": 113.683,
    "precision": "site"
  },
  "types": [
    "mine"
  ],
  "commodities": [
    {
      "metal": "thermal coal",
      "primary": true
    }
  ],
  "status": "unknown",
  "products": [],
  "sources": [
    {
      "type": "mines_csv",
      "row": 5348
    }
  ],
  "verification": {
    "status": "csv_imported",
    "confidence": 0.65,
    "last_checked": "2025-10-12T19:43:44.215829",
    "checked_by": "migration_script"
  }
}