{
  "facility_id": "bra-vila-de-itapura-fac",
  "name": "Vila De Itapura",
  "aliases": [],
  "country_iso3": "BRA",
  "location": {
    "lat": -11.556,
    "lon": -40.461,
    "precision": "site"
  },
  "types": [
    "mine"
  ],
  "commodities": [
    {
      "metal": "barium",
      "primary": true
    }
  ],
  "status": "unknown",
  "products": [],
  "sources": [
    {
      "type": "mines_csv",
      "row": 187
    }
  ],
  "verification": {
    "status": "csv_imported",
    "confidence": 0.2,
    "last_checked": "2025-10-12T19:43:42.536845",
    "checked_by": "migration_script"
  }
}