{
  "facility_id": "rus-baykaimskaya-coal-mine-fac",
  "name": "Baykaimskaya Coal Mine",
  "aliases": [],
  "country_iso3": "RUS",
  "location": {
    "lat": 54.617,
    "lon": 86.371,
    "precision": "site"
  },
  "types": [
    "mine"
  ],
  "commodities": [
    {
      "metal": "thermal coal",
      "primary": true
    }
  ],
  "status": "unknown",
  "products": [],
  "sources": [
    {
      "type": "mines_csv",
      "row": 4003
    }
  ],
  "verification": {
    "status": "csv_imported",
    "confidence": 0.65,
    "last_checked": "2025-10-12T19:43:44.109180",
    "checked_by": "migration_script"
  }
}