{
  "facility_id": "usa-no-1-ky-mfds-fac",
  "name": "No. 1 (KY MFDS)",
  "aliases": [],
  "country_iso3": "USA",
  "location": {
    "lat": 37.711,
    "lon": -83.151,
    "precision": "site"
  },
  "types": [
    "mine"
  ],
  "commodities": [
    {
      "metal": "coal",
      "primary": true
    }
  ],
  "status": "unknown",
  "products": [],
  "sources": [
    {
      "type": "mines_csv",
      "row": 7150
    }
  ],
  "verification": {
    "status": "csv_imported",
    "confidence": 0.65,
    "last_checked": "2025-10-12T19:43:44.248977",
    "checked_by": "migration_script"
  }
}