{
  "facility_id": "tr-yenik-y-lignite-mines-kemerk-y-fac",
  "name": "YenikÃ¶y Lignite Mines (KemerkÃ¶y)",
  "aliases": [
    "YenikÃ¶y Lignite Mines (KemerkÃ¶y)",
    "Yenikoy Lignite Mines (YenikÃ¶y)"
  ],
  "country_iso3": "TR",
  "location": {
    "lat": 37.163,
    "lon": 27.889,
    "precision": "site"
  },
  "types": [
    "mine"
  ],
  "commodities": [
    {
      "metal": "thermal coal",
      "primary": true
    }
  ],
  "status": "unknown",
  "owner_links": [],
  "operator_link": null,
  "products": [],
  "sources": [
    {
      "type": "mines_csv",
      "row": 4298
    }
  ],
  "verification": {
    "status": "csv_imported",
    "confidence": 0.65,
    "last_checked": "2025-10-12T19:43:44.130838",
    "checked_by": "migration_script"
  }
}